============================================================
   Tang Dynasty, V5.6.56362
   Copyright (c) 2012-2022 Anlogic
   Executable = C:/Anlogic/TD5.6.56362/bin/td.exe
   Built at =   19:51:00 Jul 25 2022
   Run by =     Frank
   Run Date =   Sat Jun  7 15:18:39 2025

   Run on =     DESKTOP-C83U48A
============================================================
RUN-1002 : start command "open_project ES8388.prj"
RUN-1001 : Print Global Property
RUN-1001 : ---------------------------------------------------------------
RUN-1001 :        Parameters        |  Settings  |  Default Values  |  Note  
RUN-1001 : ---------------------------------------------------------------
RUN-1001 :          message         |  standard  |     standard     |        
RUN-1001 :   mixed_pack_place_flow  |     on     |        on        |        
RUN-1001 :        syn_ip_flow       |    off     |       off        |        
RUN-1001 :          thread          |    auto    |       auto       |        
RUN-1001 : ---------------------------------------------------------------
RUN-1001 : Print Design Property
RUN-1001 : --------------------------------------------------------------
RUN-1001 :        Parameters       |  Settings  |  Default Values  |  Note  
RUN-1001 : --------------------------------------------------------------
RUN-1001 :   default_reg_initial   |    auto    |       auto       |        
RUN-1001 :        infer_add        |     on     |        on        |        
RUN-1001 :        infer_fsm        |    off     |       off        |        
RUN-1001 :        infer_mult       |     on     |        on        |        
RUN-1001 :        infer_ram        |     on     |        on        |        
RUN-1001 :        infer_reg        |     on     |        on        |        
RUN-1001 :   infer_reg_init_value  |     on     |        on        |        
RUN-1001 :        infer_rom        |     on     |        on        |        
RUN-1001 :      infer_shifter      |     on     |        on        |        
RUN-1001 : --------------------------------------------------------------
RUN-1001 : Print Rtl Property
RUN-1001 : --------------------------------------------------------------
RUN-1001 :        Parameters       |  Settings  |  Default Values  |  Note  
RUN-1001 : --------------------------------------------------------------
RUN-1001 :       compress_add      |   ripple   |      ripple      |        
RUN-1001 :        elf_sload        |    off     |       off        |        
RUN-1001 :       fix_undriven      |     0      |        0         |        
RUN-1001 :         flatten         |    off     |       off        |        
RUN-1001 :       gate_sharing      |     on     |        on        |        
RUN-1001 :    hdl_warning_level    |   normal   |      normal      |        
RUN-1001 :   impl_internal_tribuf  |     on     |        on        |        
RUN-1001 :      impl_set_reset     |     on     |        on        |        
RUN-1001 :        infer_gsr        |    off     |       off        |        
RUN-1001 :      keep_hierarchy     |    auto    |       auto       |        
RUN-1001 :        max_fanout       |    9999    |       9999       |        
RUN-1001 :      max_oh2bin_len     |     10     |        10        |        
RUN-1001 :       merge_equal       |     on     |        on        |        
RUN-1001 :       merge_equiv       |     on     |        on        |        
RUN-1001 :        merge_mux        |    off     |       off        |        
RUN-1001 :     min_control_set     |     8      |        8         |        
RUN-1001 :      min_ripple_len     |    auto    |       auto       |        
RUN-1001 :       oh2bin_ratio      |    0.08    |       0.08       |        
RUN-1001 :     opt_adder_fanout    |     on     |        on        |        
RUN-1001 :        opt_arith        |     on     |        on        |        
RUN-1001 :       opt_big_gate      |    off     |       off        |        
RUN-1001 :        opt_const        |     on     |        on        |        
RUN-1001 :      opt_const_mult     |     on     |        on        |        
RUN-1001 :       opt_lessthan      |     on     |        on        |        
RUN-1001 :         opt_mux         |    off     |       off        |        
RUN-1001 :         opt_ram         |    high    |       high       |        
RUN-1001 :      rtl_sim_model      |    off     |       off        |        
RUN-1001 :         seq_syn         |     on     |        on        |        
RUN-1001 : --------------------------------------------------------------
HDL-1007 : analyze verilog file ../../al_ip/clk_wiz_0.v
HDL-1007 : undeclared symbol 'open', assumed default net type 'wire' in ../../al_ip/clk_wiz_0.v(82)
HDL-1007 : analyze verilog file ../../../RTL/audio_receive.v
HDL-1007 : analyze verilog file ../../../RTL/audio_send.v
HDL-1007 : analyze verilog file ../../../RTL/audio_speak.v
HDL-1007 : undeclared symbol 'chipwatcherclk', assumed default net type 'wire' in ../../../RTL/audio_speak.v(37)
HDL-1007 : analyze verilog file ../../../RTL/es8388_config.v
HDL-1007 : analyze verilog file ../../../RTL/es8388_ctrl.v
HDL-1007 : analyze verilog file ../../../RTL/i2c_dri.v
HDL-1007 : analyze verilog file ../../../RTL/i2c_reg_cfg.v
RUN-1001 : Project manager successfully analyzed 8 source files.
RUN-1002 : start command "import_device eagle_s20.db -package EG4S20BG256"
ARC-1001 : Device Initialization.
ARC-1001 : ------------------------------------------------------------------
ARC-1001 :            OPTION            |          IO          |   SETTING   
ARC-1001 : ------------------------------------------------------------------
ARC-1001 :   cso_b/cclk/mosi/miso/dout  |  T3/R11/T10/P10/S11  |    gpio    
ARC-1001 :             done             |         P13          |    gpio    
ARC-1001 :           program_b          |          T2          |  dedicate  
ARC-1001 :        tdi/tms/tck/tdo       |   C12/A15/C14/E14    |  dedicate  
ARC-1001 : ------------------------------------------------------------------
ARC-1004 : Device setting, marked 5 dedicate IOs in total.
RUN-1002 : start command "import_db ../syn_1/ES8388_gate.db"
RUN-1001 : Importing database generated by Tang Dynasty, V5.6.56362.
RUN-1001 : Database version number 46140.
RUN-1001 : Import flow parameters
RUN-1001 : Import timing constraints
RUN-1001 : Import IO constraints
RUN-1001 : Import Inst constraints
RUN-1001 : Import design success TD_VERSION=5.6.56362 , DB_VERSION=46140
RUN-1002 : start command "read_sdc"
USR-1002 : read_sdc file_name -help -h -eco
USR-1009 : NO module with IP_SDC ...
RUN-1104 : Import SDC file  finished, there are 0 nets kept by constraints.
RUN-1002 : start command "place"
RUN-1001 : Open license file C:/Anlogic/TD5.6.56362/license/Anlogic.lic
RUN-1001 : Print Global Property
RUN-1001 : ---------------------------------------------------------------
RUN-1001 :        Parameters        |  Settings  |  Default Values  |  Note  
RUN-1001 : ---------------------------------------------------------------
RUN-1001 :          message         |  standard  |     standard     |        
RUN-1001 :   mixed_pack_place_flow  |     on     |        on        |        
RUN-1001 :        syn_ip_flow       |    off     |       off        |        
RUN-1001 :          thread          |    auto    |       auto       |        
RUN-1001 : ---------------------------------------------------------------
RUN-1001 : Print Place Property
RUN-1001 : --------------------------------------------------------------
RUN-1001 :        Parameters       |  Settings  |  Default Values  |  Note  
RUN-1001 : --------------------------------------------------------------
RUN-1001 :      detailed_place     |     on     |        on        |        
RUN-1001 :          effort         |   medium   |      medium      |        
RUN-1001 :         fix_hold        |    off     |       off        |        
RUN-1001 :       legalization      |    ori     |       ori        |        
RUN-1001 :      new_spreading      |     on     |        on        |        
RUN-1001 :        opt_timing       |   medium   |      medium      |        
RUN-1001 :   post_clock_route_opt  |    off     |       off        |        
RUN-1001 :       pr_strategy       |     1      |        1         |        
RUN-1001 :        relaxation       |    1.00    |       1.00       |        
RUN-1001 :         retiming        |    off     |       off        |        
RUN-1001 : --------------------------------------------------------------
PHY-3001 : Placer runs in 16 thread(s).
RUN-1002 : start command "legalize_phy_inst"
SYN-1011 : Flatten model clk_wiz_0
RUN-1002 : start command "phys_opt -simplify_lut"
SYN-4016 : Net clk0_out_dup_1 driven by BUFG (0 clock/control pins, 2 other pins).
SYN-4027 : Net clk1_out_dup_1 is clkc1 of pll pll_inst.
SYN-4019 : Net refclk_dup_1 is refclk of pll pll_inst.
SYN-4020 : Net refclk_dup_1 is fbclk of pll pll_inst.
SYN-4025 : Tag rtl::Net clk0_out_dup_1 as clock net
SYN-4025 : Tag rtl::Net clk1_out_dup_1 as clock net
SYN-4025 : Tag rtl::Net refclk_dup_1 as clock net
SYN-4026 : Tagged 3 rtl::Net as clock net
PHY-1001 : Populate physical database on model clk_wiz_0.
RUN-1001 : There are total 10 instances
RUN-1001 : 0 mslices, 0 lslices, 6 pads, 0 brams, 0 dsps
RUN-1001 : There are total 14 nets
RUN-1001 : 12 nets have 2 pins
RUN-1001 : 1 nets have [3 - 5] pins
RUN-1001 : 1 nets have [21 - 99] pins
RUN-1001 : Report Control nets information:
RUN-1001 : DFF Distribution
RUN-1001 : ----------------------------------
RUN-1001 :   CE   |  SSR  |  ASR  |  DFF Count  
RUN-1001 : ----------------------------------
RUN-1001 :   No   |  No   |  No   |      0      
RUN-1001 :   No   |  No   |  Yes  |      0      
RUN-1001 :   No   |  Yes  |  No   |      0      
RUN-1001 :   Yes  |  No   |  No   |      0      
RUN-1001 :   Yes  |  No   |  Yes  |      0      
RUN-1001 :   Yes  |  Yes  |  No   |      0      
RUN-1001 : ----------------------------------
RUN-0007 : Control Group Statistic
RUN-0007 : ---------------------------
RUN-0007 :   #CLK  |  #CE  |  #SSR/ASR  
RUN-0007 : ---------------------------
RUN-0007 :    0    |   0   |     0      
RUN-0007 : ---------------------------
RUN-0007 : Control Set = 0
PHY-3001 : Initial placement ...
PHY-3001 : design contains 9 instances, 0 slices, 0 macros(0 instances: 0 mslices 0 lslices)
PHY-3001 : Global placement ...
PHY-3001 : Initial: Len = 1350.8
PHY-3001 : Clustering ...
PHY-3001 : Level 0 #clusters 9.
PHY-3001 : End clustering;  0.000032s wall, 0.000000s user + 0.000000s system = 0.000000s CPU (n/a%)

PHY-3001 : Run with size of 4
PHY-3001 : Cell area utilization is 0%
PHY-3001 : :::0::: Try harder cell spreading with beta_ = 0
PHY-3002 : Step(1): len = 1044.8, overlap = 0
PHY-3002 : Step(2): len = 1044.8, overlap = 0
PHY-3002 : Step(3): len = 1044.8, overlap = 0
PHY-3001 : Legalization ...
PHY-3001 : End legalization;  0.002991s wall, 0.000000s user + 0.000000s system = 0.000000s CPU (n/a%)

PHY-3001 : Run with size of 4
PHY-3001 : Cell area utilization is 0%
PHY-3001 : Update timing in Manhattan mode ...
RUN-1002 : start command "start_timer -report"
TMR-2505 : Start building timing graph for model clk_wiz_0.
TMR-2506 : Build timing graph completely. Port num: 6, tpin num: 27, tnet num: 13, tinst num: 9, tnode num: 27, tedge num: 21.
TMR-2508 : Levelizing timing graph completed, there are 5 levels in total.
TMR-2501 : Timing graph initialized successfully.
TMR-2503 : Start to update net delay, extr mode = 3.
TMR-2504 : Update delay of 13 nets completely.
TMR-2502 : Annotate delay completely, extr mode = 3.
TMR-3001 : Initiate 0 clocks from SDC.
TMR-3004 : Map sdc constraints, there are 0 constraints in total.
TMR-3003 : Constraints initiated successfully.
TMR-3501 : Forward propagation: start to calculate arrival time...
TMR-3502 : Backward propagation: start to calculate required time...
TMR-3503 : Timing propagation completes.
PHY-3001 : End timing update;  0.022051s wall, 0.015625s user + 0.000000s system = 0.015625s CPU (70.9%)

PHY-3001 : :::0::: Try harder cell spreading with beta_ = 0
PHY-3002 : Step(4): len = 1044.8, overlap = 0
PHY-3002 : Step(5): len = 1044.8, overlap = 0
PHY-3001 : Run with size of 2
PHY-3001 : Cell area utilization is 0%
PHY-3001 : Update timing in Manhattan mode ...
TMR-2503 : Start to update net delay, extr mode = 3.
TMR-2504 : Update delay of 13 nets completely.
TMR-2502 : Annotate delay completely, extr mode = 3.
TMR-3501 : Forward propagation: start to calculate arrival time...
TMR-3502 : Backward propagation: start to calculate required time...
TMR-3503 : Timing propagation completes.
PHY-3001 : End timing update;  0.000230s wall, 0.000000s user + 0.000000s system = 0.000000s CPU (n/a%)

PHY-3001 : :::0::: Try harder cell spreading with beta_ = 0
PHY-3002 : Step(6): len = 1044.8, overlap = 0
PHY-3002 : Step(7): len = 1044.8, overlap = 0
PHY-3001 : Legalization ...
PHY-3001 : End legalization;  0.003865s wall, 0.000000s user + 0.000000s system = 0.000000s CPU (n/a%)

PHY-3001 : Trial Legalized: Len = 1044.8
PHY-3001 : Run with size of 2
PHY-3001 : Cell area utilization is 0%
PHY-3001 : Update timing in Manhattan mode ...
TMR-2503 : Start to update net delay, extr mode = 3.
TMR-2504 : Update delay of 13 nets completely.
TMR-2502 : Annotate delay completely, extr mode = 3.
TMR-3501 : Forward propagation: start to calculate arrival time...
TMR-3502 : Backward propagation: start to calculate required time...
TMR-3503 : Timing propagation completes.
PHY-3001 : End timing update;  0.000209s wall, 0.000000s user + 0.000000s system = 0.000000s CPU (n/a%)

PHY-3001 : :::0::: Try harder cell spreading with beta_ = 0
PHY-3002 : Step(8): len = 1044.8, overlap = 0
PHY-3002 : Step(9): len = 1044.8, overlap = 0
PHY-3001 : Legalization ...
PHY-3001 : End legalization;  0.003564s wall, 0.000000s user + 0.000000s system = 0.000000s CPU (n/a%)

PHY-3001 : Legalized: Len = 1044.8, Over = 0
PHY-3001 : End spreading;  0.001693s wall, 0.000000s user + 0.000000s system = 0.000000s CPU (n/a%)

PHY-3001 : Final: Len = 1044.8, Over = 0
OPT-1001 : Start physical optimization ...
RUN-1002 : start command "start_timer -report"
TMR-2505 : Start building timing graph for model clk_wiz_0.
TMR-2506 : Build timing graph completely. Port num: 6, tpin num: 27, tnet num: 13, tinst num: 9, tnode num: 27, tedge num: 21.
TMR-2508 : Levelizing timing graph completed, there are 5 levels in total.
TMR-2501 : Timing graph initialized successfully.
OPT-1001 : Total overflow 0.00 peak overflow 0.00
OPT-1001 : Start high-fanout net optimization ...
OPT-1001 : Update timing in global mode
PHY-1001 : Start incremental global routing, caller is place ...
RUN-1001 : Generating global routing grids ...
RUN-1001 : Building simple global routing graph ...
PHY-1001 : Generate routing nets ...
PHY-1001 : Reuse net number 0/14.
PHY-1001 : Global iterations in 16 thread ...
PHY-1002 : len = 1040, over cnt = 0(0%), over = 0, worst = 0
PHY-1001 : End global iterations;  0.004129s wall, 0.000000s user + 0.000000s system = 0.000000s CPU (n/a%)

PHY-1001 : Congestion index: top1 = 1.06, top5 = 0.22, top10 = 0.11, top15 = 0.07.
PHY-1001 : End incremental global routing;  0.056390s wall, 0.046875s user + 0.015625s system = 0.062500s CPU (110.8%)

TMR-2503 : Start to update net delay, extr mode = 5.
TMR-2504 : Update delay of 13 nets completely.
TMR-2502 : Annotate delay completely, extr mode = 5.
TMR-3001 : Initiate 0 clocks from SDC.
TMR-3004 : Map sdc constraints, there are 0 constraints in total.
TMR-3003 : Constraints initiated successfully.
TMR-3501 : Forward propagation: start to calculate arrival time...
TMR-3502 : Backward propagation: start to calculate required time...
TMR-3503 : Timing propagation completes.
OPT-1001 : End timing update;  0.000376s wall, 0.000000s user + 0.000000s system = 0.000000s CPU (n/a%)

OPT-1001 : 0 high-fanout net processed.
OPT-1001 : End high-fanout net optimization;  0.056951s wall, 0.046875s user + 0.015625s system = 0.062500s CPU (109.7%)

OPT-1001 : Current memory(MB): used = 132, reserve = 103, peak = 132.
OPT-1001 : Start path based optimization ...
OPT-1001 : Start congestion update ...
RUN-1001 : Generating global routing grids ...
PHY-1001 : Generate routing nets ...
PHY-1001 : Reuse net number 4/14.
PHY-1001 : Global iterations in 16 thread ...
PHY-1002 : len = 1040, over cnt = 0(0%), over = 0, worst = 0
PHY-1001 : End global iterations;  0.000809s wall, 0.000000s user + 0.000000s system = 0.000000s CPU (n/a%)

PHY-1001 : Congestion index: top1 = 1.06, top5 = 0.22, top10 = 0.11, top15 = 0.07.
OPT-1001 : End congestion update;  0.052113s wall, 0.046875s user + 0.000000s system = 0.046875s CPU (89.9%)

OPT-1001 : Update timing in Manhattan mode
TMR-2503 : Start to update net delay, extr mode = 3.
TMR-2504 : Update delay of 13 nets completely.
TMR-2502 : Annotate delay completely, extr mode = 3.
TMR-3501 : Forward propagation: start to calculate arrival time...
TMR-3502 : Backward propagation: start to calculate required time...
TMR-3503 : Timing propagation completes.
OPT-1001 : End timing update;  0.000248s wall, 0.000000s user + 0.000000s system = 0.000000s CPU (n/a%)

OPT-0007 : Start: WNS 2147483647 TNS 0 NUM_FEPS 0
OPT-1001 : End path based optimization;  0.052502s wall, 0.046875s user + 0.000000s system = 0.046875s CPU (89.3%)

OPT-1001 : Current memory(MB): used = 133, reserve = 104, peak = 133.
OPT-1001 : Update timing in Manhattan mode
TMR-2503 : Start to update net delay, extr mode = 3.
TMR-2504 : Update delay of 13 nets completely.
TMR-2502 : Annotate delay completely, extr mode = 3.
TMR-3501 : Forward propagation: start to calculate arrival time...
TMR-3502 : Backward propagation: start to calculate required time...
TMR-3503 : Timing propagation completes.
OPT-1001 : End timing update;  0.000153s wall, 0.000000s user + 0.000000s system = 0.000000s CPU (n/a%)

OPT-1001 : Start pin optimization...
OPT-1001 : skip pin optimization...
OPT-1001 : Update timing in global mode
PHY-1001 : Start incremental global routing, caller is place ...
RUN-1001 : Generating global routing grids ...
PHY-1001 : Generate routing nets ...
PHY-1001 : Reuse net number 4/14.
PHY-1001 : Global iterations in 16 thread ...
PHY-1002 : len = 1040, over cnt = 0(0%), over = 0, worst = 0
PHY-1001 : End global iterations;  0.001492s wall, 0.000000s user + 0.000000s system = 0.000000s CPU (n/a%)

PHY-1001 : Congestion index: top1 = 1.06, top5 = 0.22, top10 = 0.11, top15 = 0.07.
PHY-1001 : End incremental global routing;  0.051821s wall, 0.062500s user + 0.000000s system = 0.062500s CPU (120.6%)

TMR-2503 : Start to update net delay, extr mode = 5.
TMR-2504 : Update delay of 13 nets completely.
TMR-2502 : Annotate delay completely, extr mode = 5.
TMR-3501 : Forward propagation: start to calculate arrival time...
TMR-3502 : Backward propagation: start to calculate required time...
TMR-3503 : Timing propagation completes.
OPT-1001 : End timing update;  0.000260s wall, 0.000000s user + 0.000000s system = 0.000000s CPU (n/a%)

RUN-1001 : Generating global routing grids ...
PHY-1001 : Generate routing nets ...
PHY-1001 : Reuse net number 4/14.
PHY-1001 : Global iterations in 16 thread ...
PHY-1002 : len = 1040, over cnt = 0(0%), over = 0, worst = 0
PHY-1001 : End global iterations;  0.001951s wall, 0.000000s user + 0.000000s system = 0.000000s CPU (n/a%)

PHY-1001 : Congestion index: top1 = 1.06, top5 = 0.22, top10 = 0.11, top15 = 0.07.
OPT-1001 : Update timing in Manhattan mode
TMR-2503 : Start to update net delay, extr mode = 3.
TMR-2504 : Update delay of 13 nets completely.
TMR-2502 : Annotate delay completely, extr mode = 3.
TMR-3501 : Forward propagation: start to calculate arrival time...
TMR-3502 : Backward propagation: start to calculate required time...
TMR-3503 : Timing propagation completes.
OPT-1001 : End timing update;  0.000236s wall, 0.000000s user + 0.000000s system = 0.000000s CPU (n/a%)

RUN-1001 : QoR Analysis:
OPT-0007 :   WNS 2147483647 TNS 0 NUM_FEPS 0
RUN-1001 :   No local congestion issue, and most congested 1% tile average routing util is 0.827586
RUN-1001 :   Top critical paths
OPT-1001 : End physical optimization;  0.240664s wall, 0.203125s user + 0.031250s system = 0.234375s CPU (97.4%)

RUN-1002 : start command "export_db ES8388_place.db"
RUN-1001 : Exported /
RUN-1001 : Exported flow parameters
RUN-1001 : Exported libs
RUN-1001 : Exported entities
RUN-1001 : Exported ports
RUN-1001 : Exported pins
RUN-1001 : Exported instances
RUN-1001 : Exported nets
RUN-1001 : Exported buses
RUN-1001 : Exported models
RUN-1001 : Exported congestions
RUN-1001 : Exported violations
RUN-1001 : Exported timing constraints
RUN-1001 : Exported IO constraints
RUN-1001 : Exported Inst constraints
RUN-1002 : start command "route"
RUN-1001 : Open license file C:/Anlogic/TD5.6.56362/license/Anlogic.lic
RUN-1001 : Print Global Property
RUN-1001 : ---------------------------------------------------------------
RUN-1001 :        Parameters        |  Settings  |  Default Values  |  Note  
RUN-1001 : ---------------------------------------------------------------
RUN-1001 :          message         |  standard  |     standard     |        
RUN-1001 :   mixed_pack_place_flow  |     on     |        on        |        
RUN-1001 :        syn_ip_flow       |    off     |       off        |        
RUN-1001 :          thread          |    auto    |       auto       |        
RUN-1001 : ---------------------------------------------------------------
RUN-1001 : Print Route Property
RUN-1001 : -------------------------------------------------------
RUN-1001 :    Parameters    |  Settings  |  Default Values  |  Note  
RUN-1001 : -------------------------------------------------------
RUN-1001 :      effort      |   medium   |      medium      |        
RUN-1001 :     fix_hold     |    off     |       off        |        
RUN-1001 :    opt_timing    |   medium   |      medium      |        
RUN-1001 :   phy_sim_model  |    off     |       off        |        
RUN-1001 :     priority     |   timing   |      timing      |        
RUN-1001 :     swap_pin     |     on     |        on        |        
RUN-1001 : -------------------------------------------------------
PHY-1001 : Route runs in 16 thread(s)
RUN-1001 : There are total 10 instances
RUN-1001 : 0 mslices, 0 lslices, 6 pads, 0 brams, 0 dsps
RUN-1001 : There are total 14 nets
RUN-1001 : 12 nets have 2 pins
RUN-1001 : 1 nets have [3 - 5] pins
RUN-1001 : 1 nets have [21 - 99] pins
RUN-1002 : start command "start_timer -report"
TMR-2505 : Start building timing graph for model clk_wiz_0.
TMR-2506 : Build timing graph completely. Port num: 6, tpin num: 27, tnet num: 13, tinst num: 9, tnode num: 27, tedge num: 21.
TMR-2508 : Levelizing timing graph completed, there are 5 levels in total.
TMR-2501 : Timing graph initialized successfully.
PHY-1001 : 0 mslices, 0 lslices, 6 pads, 0 brams, 0 dsps
TMR-2503 : Start to update net delay, extr mode = 3.
TMR-2504 : Update delay of 13 nets completely.
TMR-2502 : Annotate delay completely, extr mode = 3.
TMR-3001 : Initiate 0 clocks from SDC.
TMR-3004 : Map sdc constraints, there are 0 constraints in total.
TMR-3003 : Constraints initiated successfully.
TMR-3501 : Forward propagation: start to calculate arrival time...
TMR-3502 : Backward propagation: start to calculate required time...
TMR-3503 : Timing propagation completes.
PHY-1001 : Start global routing, caller is route ...
RUN-1001 : Generating global routing grids ...
PHY-1001 : Generate routing nets ...
PHY-1001 : Global iterations in 16 thread ...
PHY-1002 : len = 1040, over cnt = 0(0%), over = 0, worst = 0
PHY-1001 : End global iterations;  0.004272s wall, 0.031250s user + 0.000000s system = 0.031250s CPU (731.6%)

PHY-1001 : Congestion index: top1 = 1.06, top5 = 0.22, top10 = 0.11, top15 = 0.07.
PHY-1001 : End global routing;  0.058084s wall, 0.062500s user + 0.015625s system = 0.078125s CPU (134.5%)

PHY-1001 : Start detail routing ...
PHY-1001 : Current memory(MB): used = 154, reserve = 125, peak = 167.
PHY-1001 : Detailed router is running in normal mode.
PHY-1001 : Generate detailed routing grids ...
PHY-1001 : Generate nets ...
PHY-1001 : clock net clk0_out_dup_1 will be merged with clock clk0_buf
PHY-1001 : net clk1_out_dup_1 will be routed on clock mesh
PHY-1001 : net refclk_dup_1 will be routed on clock mesh
PHY-1001 : Current memory(MB): used = 420, reserve = 395, peak = 420.
PHY-1001 : End build detailed router design. 3.101441s wall, 3.046875s user + 0.046875s system = 3.093750s CPU (99.8%)

PHY-1001 : Detail Route ...
PHY-1001 : ===== Detail Route Phase 1 =====
PHY-1001 : Clock net routing.....
PHY-1001 : Routed 21% nets.
PHY-1022 : len = 2184, over cnt = 0(0%), over = 0, worst = 0, crit = 0
PHY-1001 : End initial clock net routed; 0.339786s wall, 0.328125s user + 0.000000s system = 0.328125s CPU (96.6%)

PHY-1001 : Current memory(MB): used = 452, reserve = 428, peak = 452.
PHY-1001 : End phase 1; 0.346288s wall, 0.343750s user + 0.000000s system = 0.343750s CPU (99.3%)

PHY-1001 : ===== Detail Route Phase 2 =====
PHY-1001 : Initial routing.....
PHY-1001 : Routed 28% nets.
PHY-1001 : Routed 35% nets.
PHY-1001 : Routed 42% nets.
PHY-1022 : len = 3208, over cnt = 0(0%), over = 0, worst = 0, crit = 0
PHY-1001 : Current memory(MB): used = 452, reserve = 428, peak = 452.
PHY-1001 : End initial routed; 0.318182s wall, 0.312500s user + 0.000000s system = 0.312500s CPU (98.2%)

PHY-1001 : Update timing.....
PHY-1001 : 0/7(0%) critical/total net(s).
RUN-1001 : ------------------------------------------
RUN-1001 :   Type   |    WNS(ns)    |  TNS(ns)  |  FEP  
RUN-1001 : ------------------------------------------
RUN-1001 :   Setup  |  2147483.647  |   0.000   |   0   
RUN-1001 :   Hold   |  2147483.647  |   0.000   |   0   
RUN-1001 : ------------------------------------------
PHY-1001 : End update timing; 0.021195s wall, 0.015625s user + 0.000000s system = 0.015625s CPU (73.7%)

PHY-1001 : Current memory(MB): used = 452, reserve = 428, peak = 452.
PHY-1001 : End phase 2; 0.339500s wall, 0.328125s user + 0.000000s system = 0.328125s CPU (96.6%)

PHY-1001 : ===== Detail Route Phase 3 =====
PHY-1001 : Optimize timing.....
PHY-1022 : len = 3208, over cnt = 0(0%), over = 0, worst = 0, crit = 0
PHY-1001 : End optimize timing; 0.003250s wall, 0.015625s user + 0.000000s system = 0.015625s CPU (480.7%)

PHY-1001 : Update timing.....
PHY-1001 : 0/7(0%) critical/total net(s).
RUN-1001 : ------------------------------------------
RUN-1001 :   Type   |    WNS(ns)    |  TNS(ns)  |  FEP  
RUN-1001 : ------------------------------------------
RUN-1001 :   Setup  |  2147483.647  |   0.000   |   0   
RUN-1001 :   Hold   |  2147483.647  |   0.000   |   0   
RUN-1001 : ------------------------------------------
PHY-1001 : End update timing; 0.021791s wall, 0.015625s user + 0.000000s system = 0.015625s CPU (71.7%)

PHY-1001 : Commit to database.....
PHY-1001 : 0 feed throughs used by 0 nets
PHY-1001 : End commit to database; 0.005733s wall, 0.000000s user + 0.000000s system = 0.000000s CPU (n/a%)

PHY-1001 : Current memory(MB): used = 458, reserve = 434, peak = 458.
PHY-1001 : End phase 3; 0.030952s wall, 0.031250s user + 0.000000s system = 0.031250s CPU (101.0%)

PHY-1003 : Routed, final wirelength = 3208
PHY-1001 : Current memory(MB): used = 458, reserve = 434, peak = 458.
PHY-1001 : End export database. 0.006841s wall, 0.015625s user + 0.000000s system = 0.015625s CPU (228.4%)

PHY-1001 : End detail routing;  4.028148s wall, 3.953125s user + 0.046875s system = 4.000000s CPU (99.3%)

RUN-1003 : finish command "route" in  4.157294s wall, 4.093750s user + 0.062500s system = 4.156250s CPU (100.0%)

RUN-1004 : used memory is 397 MB, reserved memory is 374 MB, peak memory is 458 MB
RUN-1002 : start command "report_area -io_info -file ES8388_phy.area"
RUN-1001 : standard
***Report Model: clk_wiz_0 Device: EG4S20BG256***

IO Statistics
#IO                         6
  #input                    3
  #output                   3
  #inout                    0

Utilization Statistics
#lut                        0   out of  19600    0.00%
#reg                        0   out of  19600    0.00%
#le                         0
#dsp                        0   out of     29    0.00%
#bram                       0   out of     64    0.00%
  #bram9k                   0
  #fifo9k                   0
#bram32k                    0   out of     16    0.00%
#pad                        6   out of    188    3.19%
  #ireg                     0
  #oreg                     0
  #treg                     0
#pll                        1   out of      4   25.00%
#gclk                       2   out of     16   12.50%

Clock Resource Statistics
Index     ClockNet          Type               DriverType         Driver             Fanout
#1        refclk_dup_1      GeneralRouting     io                 refclk_syn_2.di    1
#2        clk0_buf          GCLK               pll                pll_inst.clkc0     0
#3        clk1_out_dup_1    GCLK               pll                pll_inst.clkc1     0


Detailed IO Report

    Name      Direction    Location    IOStandard    DriveStrength    PullType    PackReg  
   refclk       INPUT         F9        LVCMOS25          N/A           N/A        NONE    
   reset        INPUT         F2        LVCMOS25          N/A           N/A        NONE    
   stdby        INPUT        P15        LVCMOS25          N/A           N/A        NONE    
  clk0_out     OUTPUT        H16        LVCMOS25           8            N/A        NONE    
  clk1_out     OUTPUT        G12        LVCMOS25           8            N/A        NONE    
  extlock      OUTPUT         C5        LVCMOS25           8            N/A        NONE    

Report Hierarchy Area:
+-------------------------------------------------------------------------+
|Instance |Module    |le     |lut     |ripple  |seq     |bram    |dsp     |
+-------------------------------------------------------------------------+
|top      |clk_wiz_0 |0      |0       |0       |0       |0       |0       |
+-------------------------------------------------------------------------+


DataNet Average Fanout:

   Index     Fanout    Nets  
    #1         1        4    
  Average     1.00           

RUN-1002 : start command "export_db ES8388_pr.db"
RUN-1001 : Exported /
RUN-1001 : Exported flow parameters
RUN-1001 : Exported libs
RUN-1001 : Exported entities
RUN-1001 : Exported ports
RUN-1001 : Exported pins
RUN-1001 : Exported instances
RUN-1001 : Exported nets
RUN-1001 : Exported buses
RUN-1001 : Exported models
RUN-1001 : Exported congestions
RUN-1001 : Exported violations
RUN-1001 : Exported timing constraints
RUN-1001 : Exported IO constraints
RUN-1001 : Exported Inst constraints
RUN-1002 : start command "export_bid ES8388_inst.bid"
RUN-1002 : start command "bitgen -bit ES8388.bit"
BIT-1003 : Start to generate bitstream. 
BIT-1002 : Init instances with 16 threads.
BIT-1002 : Init instances completely, inst num: 9
BIT-1002 : Init pips with 16 threads.
BIT-1002 : Init pips completely, net num: 14, pip num: 114
BIT-1003 : Multithreading accelaration with 16 threads.
BIT-1003 : Generate bitstream completely, there are 106 valid insts, and 221 bits set as '1'.
BIT-1004 : PLL setting string = 1000
BIT-1004 : Generate bits file ES8388.bit.
RUN-1002 : start command "backup_run_log run.log ../.logs/phy_1/td_20250607_151839.log"
